{
  "masterLexemeId": "01a1070c-7c59-726e-88d6-fb5a013f6887",
  "lexemeRevision": 1,
  "language": "en",
  "lemma": "officer",
  "normalizedLemma": "officer",
  "normalizationPolicyVersion": "NFKC-LOWER-EN-1",
  "lexicalUnitType": "WORD",
  "aliases": [],
  "pronunciations": [],
  "status": "DRAFT",
  "createdAt": "2026-10-04T13:13:41.209Z",
  "updatedAt": "2026-10-04T13:13:41.209Z"
}
