{
  "masterLexemeId": "01a1070c-7c57-7676-9acf-36ec8b14c92d",
  "lexemeRevision": 1,
  "language": "en",
  "lemma": "moment",
  "normalizedLemma": "moment",
  "normalizationPolicyVersion": "NFKC-LOWER-EN-1",
  "lexicalUnitType": "WORD",
  "aliases": [],
  "pronunciations": [],
  "status": "DRAFT",
  "createdAt": "2026-10-04T13:13:41.207Z",
  "updatedAt": "2026-10-04T13:13:41.207Z"
}
