{
  "masterLexemeId": "01a1070c-7c59-726e-88d5-cb855b59039d",
  "lexemeRevision": 2,
  "language": "en",
  "lemma": "addition",
  "normalizedLemma": "addition",
  "normalizationPolicyVersion": "NFKC-LOWER-EN-1",
  "lexicalUnitType": "WORD",
  "aliases": [],
  "pronunciations": [],
  "status": "APPROVED",
  "createdAt": "2026-10-04T13:13:41.209Z",
  "updatedAt": "2026-10-04T13:13:41.209Z"
}
