{
  "masterLexemeId": "01a1070c-7c57-7676-9acd-fd76f527ed8f",
  "lexemeRevision": 1,
  "language": "en",
  "lemma": "gap",
  "normalizedLemma": "gap",
  "normalizationPolicyVersion": "NFKC-LOWER-EN-1",
  "lexicalUnitType": "WORD",
  "aliases": [],
  "pronunciations": [],
  "status": "DRAFT",
  "createdAt": "2026-10-04T13:13:41.207Z",
  "updatedAt": "2026-10-04T13:13:41.207Z"
}
