{
  "masterLexemeId": "01a0fc13-09ef-7857-9576-d74ec23a1366",
  "lexemeRevision": 1,
  "language": "en",
  "lemma": "revenue",
  "normalizedLemma": "revenue",
  "normalizationPolicyVersion": "NFKC-LOWER-EN-1",
  "lexicalUnitType": "WORD",
  "displayOrder": 13,
  "aliases": [],
  "pronunciations": [],
  "status": "IN_REVIEW",
  "createdAt": "2026-10-02T00:00:00Z",
  "updatedAt": "2026-10-02T00:00:00Z"
}
