{
  "masterLexemeId": "01a1070c-7c58-76b5-a2aa-1c3612353f47",
  "lexemeRevision": 1,
  "language": "en",
  "lemma": "commercial",
  "normalizedLemma": "commercial",
  "normalizationPolicyVersion": "NFKC-LOWER-EN-1",
  "lexicalUnitType": "WORD",
  "aliases": [],
  "pronunciations": [],
  "status": "DRAFT",
  "createdAt": "2026-10-04T13:13:41.208Z",
  "updatedAt": "2026-10-04T13:13:41.208Z"
}
