{
  "masterLexemeId": "01a1070c-7c57-7676-9acd-e539159ec92f",
  "lexemeRevision": 2,
  "language": "en",
  "lemma": "honour",
  "normalizedLemma": "honour",
  "normalizationPolicyVersion": "NFKC-LOWER-EN-1",
  "lexicalUnitType": "WORD",
  "aliases": [],
  "pronunciations": [],
  "status": "APPROVED",
  "createdAt": "2026-10-04T13:13:41.207Z",
  "updatedAt": "2026-10-04T13:13:41.207Z"
}
